{"verdict":"APPROVED","confidence":"HIGH","tasks":[{"id":"UC-MOL-02-android","verdict":"APPROVED","requirements":[{"id":"AC-1","satisfied":true,"evidence":"[android/app/src/main/java/com/laneshadow/ui/molecules/LSToolbar.kt:66-72] defines `ToolbarHeightComponentToken = 56.dp` and routes `toolbarComponentSizing.toolbarHeight` through it instead of any spacing rung; canonical source remains [tokens/semantic/dimensions.tokens.json:144-147] (`toolbarHeight = 56`), while the Kotlin generated token surface exposes `sizing.icon`/`sizing.stroke` only and no component-height API ([tokens/platforms/kotlin/src/main/java/com/laneshadow/theme/generated/Tokens.kt:383-394], [tokens/platforms/kotlin/src/main/kotlin/com/laneshadow/theme/LaneShadowTheme.kt:145-177]). [android/app/src/test/java/com/laneshadow/ui/molecules/LSToolbarTest.kt:39-72] now asserts `56.dp` directly, independent of `theme.toolbarComponentSizing`. Re-ran `cd android && ./gradlew :app:testDebugUnitTest --tests \"com.laneshadow.ui.molecules.LSToolbarTest\" --tests \"com.laneshadow.ui.molecules.LSNavHeaderTest\"` => `BUILD SUCCESSFUL`.","remediation":null},{"id":"AC-2","satisfied":true,"evidence":"[android/app/src/test/java/com/laneshadow/ui/molecules/LSToolbarTest.kt:75-102] still exercises title-only and two-action variants, and [android/app/src/main/java/com/laneshadow/ui/molecules/LSToolbar.kt:209-249] preserves the two-action trailing row with `Arrangement.spacedBy(actionGap)`. Re-ran `cd android && ./gradlew :app:testDebugUnitTest --tests \"com.laneshadow.ui.molecules.LSToolbarTest\" --tests \"com.laneshadow.ui.molecules.LSNavHeaderTest\"` => `BUILD SUCCESSFUL`.","remediation":null},{"id":"AC-3","satisfied":true,"evidence":"[android/app/src/main/java/com/laneshadow/ui/molecules/LSNavHeader.kt:114-134] renders the large-title variant with `LSText(... TypographyVariant.Opinion.Lg ...)`, and [android/app/src/test/java/com/laneshadow/ui/molecules/LSNavHeaderTest.kt:31-47] still asserts `Opinion.Lg`. Re-ran `cd android && ./gradlew :app:testDebugUnitTest --tests \"com.laneshadow.ui.molecules.LSToolbarTest\" --tests \"com.laneshadow.ui.molecules.LSNavHeaderTest\"` => `BUILD SUCCESSFUL`.","remediation":null},{"id":"AC-4","satisfied":true,"evidence":"[android/app/src/main/java/com/laneshadow/ui/molecules/LSNavHeader.kt:136-166] keeps `verticalArrangement = Arrangement.spacedBy(style.subtitleGap)` and subtitle `LSText(... TypographyVariant.Ui.Body.Md, color = ContentColor.Tertiary ...)`; [android/app/src/test/java/com/laneshadow/ui/molecules/LSNavHeaderTest.kt:50-77] asserts exact `LSNavHeaderVerticalGapKey` and exact `LSNavHeaderSubtitleColorKey`. Re-ran `cd android && ./gradlew :app:testDebugUnitTest --tests \"com.laneshadow.ui.molecules.LSToolbarTest\" --tests \"com.laneshadow.ui.molecules.LSNavHeaderTest\"` => `BUILD SUCCESSFUL`.","remediation":null},{"id":"AC-5","satisfied":true,"evidence":"[android/app/src/main/java/com/laneshadow/ui/molecules/LSToolbar.kt:123-145] still applies `windowInsetsPadding(windowInsets)` with default `WindowInsets.systemBars`, and [android/app/src/androidTest/java/com/laneshadow/ui/molecules/LSToolbarUiTest.kt:28-70] verifies the injected-top-inset delta exactly. Re-ran `cd android && ./gradlew :app:connectedDebugAndroidTest -Pandroid.testInstrumentationRunnerArguments.class=com.laneshadow.ui.molecules.LSToolbarUiTest` on `Pixel_7_API_34(AVD) - 14` => `Finished 1 tests ... BUILD SUCCESSFUL`.","remediation":null},{"id":"AC-6","satisfied":true,"evidence":"Story IDs total 7 across [android/app/src/debug/java/com/laneshadow/sandbox/stories/molecules/LSToolbarStory.kt:15-48] and [android/app/src/debug/java/com/laneshadow/sandbox/stories/molecules/LSNavHeaderStory.kt:12-32]; `grep -c 'molecules.toolbar\\|molecules.navheader' ...` returned `7`. `rg -n 'Color\\(0xFF' android/app/src/main/java/com/laneshadow/ui/molecules/LSToolbar.kt android/app/src/main/java/com/laneshadow/ui/molecules/LSNavHeader.kt` returned no matches.","remediation":null}]}],"findings":[],"summary":"APPROVED: the toolbar height now resolves through a dedicated 56dp bridge tied to the canonical component token source rather than a spacing rung, the AC-1 test independently proves 56dp, and AC-2 through AC-6 all pass on the current worktree, including the connected insets test on Pixel_7_API_34(AVD) - 14."}
