{
  "verdict": "APPROVED",
  "confidence": "HIGH",
  "tasks": [
    {
      "id": "ALIGN-02-ios",
      "verdict": "APPROVED",
      "requirements": [
        {
          "id": "AC-1",
          "satisfied": true,
          "evidence": "`tokens/semantic/colors.tokens.json` now carries `surface.scrim-soft` and `border.glass`, and `tokens/platforms/swift/Sources/LaneShadowTheme/Generated/Tokens.swift` emits `LaneShadowTheme.color.surface.scrimSoft` plus `LaneShadowTheme.color.border.glass` with the required dynamic light/dark values.",
          "remediation": null
        },
        {
          "id": "AC-2",
          "satisfied": true,
          "evidence": "`Tokens.swift` now emits `LaneShadowTheme.color.map.paper`, `.contour`, and `.contourFaint` from the shared generator output.",
          "remediation": null
        },
        {
          "id": "AC-3",
          "satisfied": true,
          "evidence": "`Tokens.swift` now emits `LaneShadowTheme.map.style.light` and `.dark` as exact `String` constants for the Mapbox style URLs.",
          "remediation": null
        },
        {
          "id": "AC-4",
          "satisfied": true,
          "evidence": "`Tokens.swift` now emits `LaneShadowTheme.sizing.stroke.sm/md/lg` as `CGFloat` with values `1`, `2`, and `3`.",
          "remediation": null
        },
        {
          "id": "AC-5",
          "satisfied": true,
          "evidence": "`pnpm tokens:validate` and `pnpm tokens:sync-check` both exit 0 on the checkpoint branch. The full-tree `swiftformat --lint ios/LaneShadow/` failure remains pre-existing out-of-scope debt in `ios/LaneShadow/Views/Molecules/**`, not a regression from this task.",
          "remediation": null
        },
        {
          "id": "AC-6",
          "satisfied": true,
          "evidence": "`cd ios && xcodebuild build -scheme LaneShadow -destination 'platform=iOS Simulator,name=iPhone 16'` completed with `BUILD SUCCEEDED` on checkpoint `8d00b18d24442a7a7f883f123f9f99c362d28274`.",
          "remediation": null
        },
        {
          "id": "TC-1",
          "satisfied": true,
          "evidence": "`LaneShadowTheme.color.surface.scrimSoft` exists in generated `Tokens.swift`.",
          "remediation": null
        },
        {
          "id": "TC-2",
          "satisfied": true,
          "evidence": "`LaneShadowTheme.color.border.glass` exists in generated `Tokens.swift`.",
          "remediation": null
        },
        {
          "id": "TC-3",
          "satisfied": true,
          "evidence": "`Tokens.swift` contains the `map` color enum with `paper`, `contour`, and `contourFaint`.",
          "remediation": null
        },
        {
          "id": "TC-4",
          "satisfied": true,
          "evidence": "`Tokens.swift` contains both `mapbox://styles/laneshadow/clxwarm01` and `mapbox://styles/laneshadow/clxnight02` under `LaneShadowTheme.map.style`.",
          "remediation": null
        },
        {
          "id": "TC-5",
          "satisfied": true,
          "evidence": "`LaneShadowTheme.sizing.stroke.sm` is emitted as `CGFloat = 1` in generated `Tokens.swift`.",
          "remediation": null
        },
        {
          "id": "TC-6",
          "satisfied": true,
          "evidence": "`pnpm tokens:generate` exits 0 on the checkpoint branch.",
          "remediation": null
        },
        {
          "id": "TC-7",
          "satisfied": true,
          "evidence": "The generated Swift file still begins with `// GENERATED by tokens/scripts/generate.ts — do not edit by hand`.",
          "remediation": null
        },
        {
          "id": "STATE-MATRIX",
          "satisfied": true,
          "evidence": "The generated Swift surface now includes the required hover/state additions, including `LaneShadowTheme.color.signal.hover`, status tint tokens, and the other Copper gaps called out by the drift report.",
          "remediation": null
        }
      ]
    }
  ],
  "findings": [],
  "summary": "APPROVED. ALIGN-02-ios now emits the full required Copper token surface on iOS, passes `tokens:validate`, `tokens:sync-check`, and `xcodebuild build`, and the coupled generator outputs remain limited to expected consequences of the shared generator change. The only remaining lint failure is pre-existing out-of-scope SwiftFormat debt in molecule files unrelated to this task."
}
