{"verdict":"NEEDS_FIXES","confidence":"HIGH","tasks":[{"id":"UC-MOL-01-ios","verdict":"NEEDS_FIXES","requirements":[{"id":"AC-1","satisfied":false,"evidence":"`ios/LaneShadowTests/Molecules/LSContentCardTests.swift:10` now provides the exact selector and it passes, but the assertions at lines 16-23 only check stored properties plus helper/token accessors (`LSCard.cornerRadius`, `LSCard.elevation`, `LSContentCard.bodyVerticalSpacing`, typography helper methods). The test does not verify rendered `LSCard` composition or `LSText` usage through the public view surface.","remediation":"Replace the helper-level assertions with hosted/view-inspection assertions that prove `LSContentCard` actually composes `LSCard` and renders title/subtitle via the expected `LSText` variants."},{"id":"AC-2","satisfied":false,"evidence":"`ios/LaneShadowTests/Molecules/LSContentCardTests.swift:26` has the required selector and passes, but lines 38-42 only assert `footerTopPadding`, `metadata.count`, `hasActionsFooter`, and `bodyBottomPaddingWhenFooterMissing`. During the targeted `xcodebuild test` run, this test emitted a SwiftUI runtime warning: `Accessing Environment<Theme>'s value outside of being installed on a View`, which confirms it is reading view internals instead of verifying rendered footer placement.","remediation":"Host the card in a view hierarchy and assert that metadata appears above the footer actions, the divider/actions render only when supplied, and no extra bottom gap is present when actions are absent."},{"id":"AC-3","satisfied":false,"evidence":"`ios/LaneShadowTests/Molecules/LSListRowTests.swift:7` has the exact selector and passes, but lines 15-20 only compare token helper methods and stored properties (`rowSpacing`, `verticalPadding`, `minimumTouchTarget`, `trailingIconName`, `row.title`, `row.subtitle`). It does not verify rendered spacing, the 44pt touch target, or chevron composition from the public view output.","remediation":"Assert the hosted row's rendered layout and accessibility tree instead of helper return values, including the chevron atom and the 44pt minimum touch target."},{"id":"AC-4","satisfied":false,"evidence":"`ios/LaneShadowTests/Molecules/LSListRowTests.swift:24` has the exact selector and passes, but it calls `interactive.performPrimaryAction()` directly at line 35, then checks helper methods `hasSemanticToggle` and `backgroundToken` at lines 45-48. That does not verify tap behavior through the public interaction surface and does not exercise pressed/highlight behavior at all.","remediation":"Drive the interaction through the rendered button/row surface, assert the callback fires exactly once from a tap, and verify the non-interactive row does not expose pressed/highlight behavior."},{"id":"AC-5","satisfied":true,"evidence":"Manual grep over `ios/LaneShadow/Views/Molecules/LSContentCard.swift` and `ios/LaneShadow/Views/Molecules/LSListRow.swift` returned no matches for `Color(red:)`, `Color(hex:)`, `Font.system`, or `foregroundColor(`. The current sources use `foregroundStyle` and theme/token-driven values.","remediation":null},{"id":"AC-6","satisfied":true,"evidence":"`ios/LaneShadowTests/Molecules/LSContentCardTests.swift:45` defines `test_all_ten_stories_registered`, checks all 10 expected molecule story IDs, filters the molecule stories to count 10 total, and hosts each story in both light and dark color schemes at lines 69-71. The targeted `xcodebuild test` run passed this selector.","remediation":null}]}],"findings":[{"severity":"HIGH","task_id":"UC-MOL-01-ios","location":"ios/LaneShadowTests/Molecules/LSContentCardTests.swift:10","evidence":"The remediation added the required selectors, but `test_default_render_uses_surface_card_tokens` and `test_action_footer_slot_renders_below_metadata` still validate helper methods and stored state instead of rendered molecule behavior. `test_action_footer_slot_renders_below_metadata` also triggered a SwiftUI warning during the real test run because it reads `@Environment`-backed state outside a hosted view.","fix":"Rewrite the content-card contract tests to host the view and assert the real rendered structure: `LSCard` surface/token behavior, `LSText` variants, metadata-to-footer ordering, and zero extra gap when footer actions are absent."},{"severity":"HIGH","task_id":"UC-MOL-01-ios","location":"ios/LaneShadowTests/Molecules/LSListRowTests.swift:24","evidence":"`test_ontap_fires_once_and_no_highlight_without_handler` invokes `performPrimaryAction()` directly and then asserts helper methods (`hasSemanticToggle`, `backgroundToken`) rather than the public SwiftUI interaction surface. `test_layout_tokens_and_minimum_touch_target` similarly checks helper accessors instead of rendered spacing, chevron composition, or 44pt touch target behavior.","fix":"Replace the helper-based assertions with hosted interaction/layout checks that simulate a user tap, verify exactly-once callback behavior, verify the static row has no pressed/highlight affordance, and confirm the rendered chevron/touch-target contract."},{"severity":"MEDIUM","task_id":"UC-MOL-01-ios","location":"/Users/justinrich/Projects/LaneShadow/.kb-run/tasks/UC-MOL-01-ios/iterations/002/uc-mol-01-ios-remediation-iteration-002.png","evidence":"The supplied screenshot artifact is only the iPhone simulator home screen; it does not show the LaneShadow sandbox or either molecule. It is not valid visual verification for this task.","fix":"Capture a screenshot of the actual molecule stories or sandbox screen under review and compare that UI against the task/spec behavior instead of attaching a simulator-home-screen image."},{"severity":"MEDIUM","task_id":"UC-MOL-01-ios","location":"/Users/justinrich/Projects/LaneShadow/.kb-run/tasks/UC-MOL-01-ios/iterations/002/implementer-response.json","evidence":"The implementer artifact records only green-path commands and success statuses. It does not include RED-phase evidence showing the required selectors failed before the remediation was applied.","fix":"Attach failing pre-fix test evidence for each contract selector so TDD compliance can be verified rather than inferred."}],"summary":"Targeted `xcodebuild build` and the five contract selectors pass on this worktree, and AC-5 plus AC-6 are satisfied. The task still needs fixes because AC-1 through AC-4 are backed by helper/property tests rather than public rendered behavior or interaction verification, and the supplied screenshot is not valid visual verification."}